{
  "meeting_id": "MTG-CASE-01",
  "project_id": "PJT-001",
  "review_sample_count": 5,
  "review_result": "一致支持",
  "consistency_summary": "当前会议结论（强调灰度条件、聚焦高风险点、要求明确证据）与历史会议信号高度一致。历史会议多次强调退款回调清零、样本补齐、回滚演练完成作为灰度硬门槛，当前会议延续并强化了这一管理口径，未发现冲突信号。",
  "supporting_signals": [
    "历史会议 HIS-001 明确要求‘退款回调问题不清零，不进入灰度申请’，与当前会议 stmt-6、stmt-48 等口径一致。",
    "历史会议 HIS-002 确认灰度条件必须与关键链路验证完成度绑定，与当前会议 stmt-14、stmt-37 等强调‘条件齐了才提灰度’一致。",
    "历史会议 HIS-003 和 HIS-004 均强调回滚演练的重要性，与当前会议 stmt-12、stmt-23 等对回滚演练的聚焦一致。",
    "历史会议 HIS-005 同意以样本齐套作为灰度前条件，与当前会议 stmt-10、stmt-55 等对样本覆盖的要求一致。",
    "历史信号 risk_notes 指出‘项目存在把‘主链路稳定’放大为‘整体已准备好’的倾向’，当前会议 stmt-26、stmt-55 等明确反对此倾向，管理口径得到纠正和强化。"
  ],
  "conflict_signals": [],
  "confidence": 0.95
}